{
  "id": "ro-ministerul-justitiei",
  "slug": "ministerul-justitiei",
  "name": "Ministerul Justiției",
  "shortname": "mj",
  "category": "minister",
  "meta": {
    "version": "1.0",
    "last_updated": "2026-02-15",
    "keywords": [
      "justiție",
      "minister",
      "drept",
      "legislație",
      "sistem judiciar"
    ],
    "quality": "draft"
  },
  "location": {
    "country_code": "RO",
    "county": null,
    "city": "București"
  },
  "description": "Ministerul Justiției este instituția guvernamentală responsabilă cu elaborarea politicilor în domeniul justiției, elaborarea de acte normative și coordonarea activităților care privesc funcționarea sistemului judiciar. Asigură cadrul legal pentru organizarea și funcționarea instanțelor și parchetelor din România.",
  "usage_notes": null,
  "colors": [
    {
      "name": "negru",
      "hex": "#000000",
      "rgb": [
        0,
        0,
        0
      ],
      "cmyk": null,
      "pantone": null,
      "usage": "neutral"
    },
    {
      "name": "alb",
      "hex": "#FFFFFF",
      "rgb": [
        255,
        255,
        255
      ],
      "cmyk": null,
      "pantone": null,
      "usage": "neutral"
    }
  ],
  "typography": null,
  "resources": {
    "website": null,
    "branding_manual": null,
    "social_media": null
  },
  "assets": {
    "main": {
      "type": "horizontal",
      "color": "/logos/ro-ministerul-justitiei/horizontal/color.svg",
      "dark_mode": null,
      "white": "/logos/ro-ministerul-justitiei/horizontal/white.svg",
      "black": "/logos/ro-ministerul-justitiei/horizontal/black.svg",
      "monochrome": null,
      "png": null
    },
    "horizontal": {
      "type": "horizontal",
      "color": "/logos/ro-ministerul-justitiei/horizontal/color.svg",
      "dark_mode": null,
      "white": "/logos/ro-ministerul-justitiei/horizontal/white.svg",
      "black": "/logos/ro-ministerul-justitiei/horizontal/black.svg",
      "monochrome": null,
      "png": null
    },
    "vertical": null,
    "symbol": null,
    "favicon": null
  }
}
