{
  "id": "ro-cfr-marfa",
  "slug": "cfr-marfa",
  "name": "CFR Marfă SA",
  "shortname": "cfr marfă",
  "category": "agentie",
  "meta": {
    "version": "1.0",
    "last_updated": "2026-02-15",
    "keywords": [
      "cfr",
      "transport",
      "feroviar",
      "marfă",
      "logistică"
    ],
    "quality": "draft"
  },
  "location": {
    "country_code": "RO",
    "county": null,
    "city": null
  },
  "description": "CFR Marfă SA este operator național de transport feroviar de marfă în România, responsabil pentru transportul și logistica mărfurilor pe calea ferată. Compania gestionează serviciile de freight rail și infrastructura operațională necesară pentru circulația trenurilor de marfă.",
  "usage_notes": null,
  "colors": [
    {
      "name": "Color #0D3567",
      "hex": "#0D3567",
      "rgb": [
        13,
        53,
        103
      ],
      "cmyk": null,
      "pantone": null,
      "usage": "primary"
    },
    {
      "name": "Color #972B2D",
      "hex": "#972B2D",
      "rgb": [
        151,
        43,
        45
      ],
      "cmyk": null,
      "pantone": null,
      "usage": "secondary"
    },
    {
      "name": "Color #1D3766",
      "hex": "#1D3766",
      "rgb": [
        29,
        55,
        102
      ],
      "cmyk": null,
      "pantone": null,
      "usage": null
    },
    {
      "name": "Color #D82927",
      "hex": "#D82927",
      "rgb": [
        216,
        41,
        39
      ],
      "cmyk": null,
      "pantone": null,
      "usage": null
    },
    {
      "name": "Color #FAE600",
      "hex": "#FAE600",
      "rgb": [
        250,
        230,
        0
      ],
      "cmyk": null,
      "pantone": null,
      "usage": null
    }
  ],
  "typography": null,
  "resources": {
    "website": null,
    "branding_manual": null,
    "social_media": null
  },
  "assets": {
    "main": {
      "type": "symbol",
      "color": "/logos/ro-cfr-marfa/symbol/color.svg",
      "dark_mode": null,
      "white": null,
      "black": null,
      "monochrome": null,
      "png": null
    },
    "horizontal": null,
    "vertical": null,
    "symbol": {
      "type": "symbol",
      "color": "/logos/ro-cfr-marfa/symbol/color.svg",
      "dark_mode": null,
      "white": null,
      "black": null,
      "monochrome": null,
      "png": null
    },
    "favicon": null
  }
}
