{
  "id": "ro-ministerul-investitiilor-europene",
  "slug": "ministerul-investitiilor-europene",
  "name": "Ministerul Investițiilor și Proiectelor Europene",
  "shortname": "mipe",
  "category": "minister",
  "meta": {
    "version": "1.0",
    "last_updated": "2026-02-15",
    "keywords": [
      "investiții",
      "proiecte europene",
      "fonduri europene",
      "minister",
      "dezvoltare",
      "absorbție fonduri"
    ],
    "quality": "draft"
  },
  "location": {
    "country_code": "RO",
    "county": null,
    "city": "București"
  },
  "description": "Ministerul Investițiilor și Proiectelor Europene este instituția guvernamentală responsabilă de gestionarea, coordonarea și implementarea investițiilor și proiectelor finanțate din fonduri europene în România. Asigură absorbția fondurilor UE și elaborează strategii pentru dezvoltare regională și proiecte de infrastructură.",
  "usage_notes": null,
  "colors": [
    {
      "name": "Color #004990",
      "hex": "#004990",
      "rgb": [
        0,
        73,
        144
      ],
      "cmyk": null,
      "pantone": null,
      "usage": "primary"
    }
  ],
  "typography": null,
  "resources": {
    "website": null,
    "branding_manual": null,
    "social_media": null
  },
  "assets": {
    "main": {
      "type": "horizontal",
      "color": "/logos/ro-ministerul-investitiilor-europene/horizontal/color.svg",
      "dark_mode": null,
      "white": "/logos/ro-ministerul-investitiilor-europene/horizontal/white.svg",
      "black": "/logos/ro-ministerul-investitiilor-europene/horizontal/black.svg",
      "monochrome": null,
      "png": null
    },
    "horizontal": {
      "type": "horizontal",
      "color": "/logos/ro-ministerul-investitiilor-europene/horizontal/color.svg",
      "dark_mode": null,
      "white": "/logos/ro-ministerul-investitiilor-europene/horizontal/white.svg",
      "black": "/logos/ro-ministerul-investitiilor-europene/horizontal/black.svg",
      "monochrome": null,
      "png": null
    },
    "vertical": null,
    "symbol": null,
    "favicon": null
  }
}
