{
  "id": "md-guvern",
  "slug": "guvern",
  "name": "Guvernul Republicii Moldova",
  "shortname": "guvern",
  "category": "guvern",
  "meta": {
    "version": "1.0",
    "last_updated": "2026-10-10",
    "keywords": [
      "moldova",
      "guvern",
      "executiv"
    ],
    "quality": "draft",
    "seo_title": "Guvernul Republicii Moldova | Sigla Oficială | Identitate.md",
    "seo_description": "Descarcă sigla oficială a Guvernului Republicii Moldova în format SVG. Logo, culori HEX/RGB și identitatea vizuală oficială."
  },
  "location": {
    "country_code": "MD",
    "city": "Chișinău"
  },
  "description": "Guvernul Republicii Moldova este autoritatea executivă care asigură realizarea politicii interne și externe a statului și conduce administrația publică.",
  "colors": [
    {
      "name": "Albastru Oficial",
      "hex": "#0E4C90",
      "rgb": [
        14,
        76,
        144
      ],
      "usage": "primary"
    }
  ],
  "typography": {
    "primary": {
      "family": "Trajan Pro",
      "weights": [
        400,
        700
      ]
    },
    "secondary": {
      "family": "Onest",
      "weights": [
        400,
        700
      ]
    }
  },
  "assets": {
    "main": {
      "type": "symbol",
      "color": "/logos/md-guvern/symbol-color.svg",
      "white": "/logos/md-guvern/symbol-white.svg"
    },
    "horizontal": {
      "type": "horizontal",
      "color": "/logos/md-guvern/horizontal-color.svg",
      "white": "/logos/md-guvern/horizontal-white.svg"
    },
    "symbol": {
      "type": "symbol",
      "color": "/logos/md-guvern/symbol-color.svg",
      "white": "/logos/md-guvern/symbol-white.svg",
      "alternatives": [
        {
          "label": "Alternative Color",
          "path": "/logos/md-guvern/symbol-color-alternative.svg",
          "preview": "checkerboard"
        }
      ]
    }
  },
  "resources": {
    "website": "https://www.gov.md",
    "branding_manual": "https://1xia3dwdv1.ufs.sh/f/zvXEkxD3opbQ4RymY8SJyFHl30vBgsr24AQJmYdnizjqpV7K",
    "social_media": {
      "facebook": "https://www.facebook.com/guvernulrepubliciimodova",
      "twitter": "https://twitter.com/GovMD"
    }
  }
}
