{
  "id": "md-eu-flag",
  "slug": "eu-flag",
  "name": "Steagul Uniunii Europene",
  "shortname": "ue",
  "category": "altele",
  "meta": {
    "version": "1.0",
    "last_updated": "2026-10-10",
    "keywords": [
      "uniunea europeană",
      "steag",
      "steagul european",
      "simbol",
      "ue"
    ],
    "quality": "draft",
    "seo_title": "Steagul UE | Sigla Oficială | Identitate.md",
    "seo_description": "Descarcă sigla oficială a Steagului Uniunii Europene în format SVG. Logo, culori HEX/RGB și identitatea vizuală oficială."
  },
  "location": {
    "country_code": "RO",
    "county": null,
    "city": null
  },
  "description": "Drapelul european simbolizează Uniunea Europeană și, mai larg, unitatea Europei. Are 12 stele aurii dispuse în cerc pe un fond albastru; numărul stelelor nu reprezintă numărul statelor membre.",
  "usage_notes": null,
  "colors": [
    {
      "name": "Color #FFCC00",
      "hex": "#FFCC00",
      "rgb": [
        255,
        204,
        0
      ],
      "cmyk": null,
      "pantone": null,
      "usage": "primary"
    },
    {
      "name": "Color #003399",
      "hex": "#003399",
      "rgb": [
        0,
        51,
        153
      ],
      "cmyk": null,
      "pantone": null,
      "usage": "secondary"
    }
  ],
  "typography": null,
  "resources": {
    "website": "https://european-union.europa.eu/principles-countries-history/symbols/european-flag_ro",
    "branding_manual": null,
    "social_media": null
  },
  "assets": {
    "main": {
      "type": "symbol",
      "color": "/logos/eu-flag/symbol/color.svg",
      "dark_mode": null,
      "white": "/logos/eu-flag/symbol/white.svg",
      "black": "/logos/eu-flag/symbol/black.svg",
      "monochrome": null,
      "png": null
    },
    "horizontal": null,
    "vertical": null,
    "symbol": {
      "type": "symbol",
      "color": "/logos/eu-flag/symbol/color.svg",
      "dark_mode": null,
      "white": "/logos/eu-flag/symbol/white.svg",
      "black": "/logos/eu-flag/symbol/black.svg",
      "monochrome": null,
      "png": null
    },
    "favicon": null
  }
}
