{
  "id": "ro-camera-deputatilor",
  "slug": "camera-deputatilor",
  "name": "Camera Deputaților",
  "shortname": "camera deputaților",
  "category": "altele",
  "meta": {
    "version": "1.0",
    "last_updated": "2026-02-15",
    "keywords": [
      "parlament",
      "legislativ",
      "deputați",
      "camera deputaților",
      "bucurești"
    ],
    "quality": "draft"
  },
  "location": {
    "country_code": "RO",
    "county": null,
    "city": "București"
  },
  "description": "Camera Deputaților este una dintre cele două camere ale Parlamentului României, având rol legislativ în elaborarea și adoptarea legilor. Instituția reprezintă corpul deputaților aleși și funcționează în sediul său din București.",
  "usage_notes": null,
  "colors": [
    {
      "name": "Color #F5CE67",
      "hex": "#F5CE67",
      "rgb": [
        245,
        206,
        103
      ],
      "cmyk": null,
      "pantone": null,
      "usage": "primary"
    },
    {
      "name": "Color #F5CE66",
      "hex": "#F5CE66",
      "rgb": [
        245,
        206,
        102
      ],
      "cmyk": null,
      "pantone": null,
      "usage": "secondary"
    },
    {
      "name": "Color #E31E24",
      "hex": "#E31E24",
      "rgb": [
        227,
        30,
        36
      ],
      "cmyk": null,
      "pantone": null,
      "usage": null
    },
    {
      "name": "Color #505E5F",
      "hex": "#505E5F",
      "rgb": [
        80,
        94,
        95
      ],
      "cmyk": null,
      "pantone": null,
      "usage": null
    },
    {
      "name": "Color #0777CF",
      "hex": "#0777CF",
      "rgb": [
        7,
        119,
        207
      ],
      "cmyk": null,
      "pantone": null,
      "usage": null
    },
    {
      "name": "Color #AF0000",
      "hex": "#AF0000",
      "rgb": [
        175,
        0,
        0
      ],
      "cmyk": null,
      "pantone": null,
      "usage": null
    },
    {
      "name": "Color #FFED00",
      "hex": "#FFED00",
      "rgb": [
        255,
        237,
        0
      ],
      "cmyk": null,
      "pantone": null,
      "usage": null
    }
  ],
  "typography": null,
  "resources": {
    "website": null,
    "branding_manual": null,
    "social_media": null
  },
  "assets": {
    "main": {
      "type": "symbol",
      "color": "/logos/ro-camera-deputatilor/symbol/color.svg",
      "dark_mode": null,
      "white": null,
      "black": null,
      "monochrome": null,
      "png": null
    },
    "horizontal": null,
    "vertical": null,
    "symbol": {
      "type": "symbol",
      "color": "/logos/ro-camera-deputatilor/symbol/color.svg",
      "dark_mode": null,
      "white": null,
      "black": null,
      "monochrome": null,
      "png": null
    },
    "favicon": null
  }
}
