{
  "id": "ro-ministerul-afacerilor-externe",
  "slug": "ministerul-afacerilor-externe",
  "name": "Ministerul Afacerilor Externe",
  "shortname": "mae",
  "category": "minister",
  "meta": {
    "version": "1.0",
    "last_updated": "2026-02-15",
    "keywords": [
      "minister",
      "afaceri externe",
      "diplomație",
      "relații internaționale",
      "consular"
    ],
    "quality": "draft"
  },
  "location": {
    "country_code": "RO",
    "county": "B",
    "city": "București"
  },
  "description": "Ministerul Afacerilor Externe (MAE) este instituția guvernamentală responsabilă de politica externă a României, diplomație și protecția cetățenilor români în străinătate. Coordonează relațiile internaționale, negocierile diplomatice și activitățile consulare.",
  "usage_notes": null,
  "colors": [
    {
      "name": "Color #004990",
      "hex": "#004990",
      "rgb": [
        0,
        73,
        144
      ],
      "cmyk": null,
      "pantone": null,
      "usage": "primary"
    }
  ],
  "typography": null,
  "resources": {
    "website": null,
    "branding_manual": null,
    "social_media": null
  },
  "assets": {
    "main": {
      "type": "horizontal",
      "color": "/logos/ro-ministerul-afacerilor-externe/horizontal/color.svg",
      "dark_mode": null,
      "white": "/logos/ro-ministerul-afacerilor-externe/horizontal/white.svg",
      "black": "/logos/ro-ministerul-afacerilor-externe/horizontal/black.svg",
      "monochrome": null,
      "png": null
    },
    "horizontal": {
      "type": "horizontal",
      "color": "/logos/ro-ministerul-afacerilor-externe/horizontal/color.svg",
      "dark_mode": null,
      "white": "/logos/ro-ministerul-afacerilor-externe/horizontal/white.svg",
      "black": "/logos/ro-ministerul-afacerilor-externe/horizontal/black.svg",
      "monochrome": null,
      "png": null
    },
    "vertical": null,
    "symbol": null,
    "favicon": null
  }
}
