{
  "id": "ro-stema",
  "slug": "stema",
  "name": "Stema României",
  "shortname": "stema",
  "category": "altele",
  "meta": {
    "version": "1.0",
    "last_updated": "2026-02-15",
    "keywords": [
      "stemă",
      "emblemă",
      "heraldică",
      "simbol național",
      "sigiliu"
    ],
    "quality": "draft"
  },
  "location": {
    "country_code": "RO",
    "county": null,
    "city": null
  },
  "description": "Stema României este simbolul heraldic oficial al României, utilizat pentru reprezentare oficială. Pachetul curent conține versiunea color a simbolului.",
  "usage_notes": null,
  "colors": [
    {
      "name": "Color #C40000",
      "hex": "#C40000",
      "rgb": [
        196,
        0,
        0
      ],
      "cmyk": null,
      "pantone": null,
      "usage": "primary"
    },
    {
      "name": "Color #DA251D",
      "hex": "#DA251D",
      "rgb": [
        218,
        37,
        29
      ],
      "cmyk": null,
      "pantone": null,
      "usage": "secondary"
    },
    {
      "name": "Color #1C63B7",
      "hex": "#1C63B7",
      "rgb": [
        28,
        99,
        183
      ],
      "cmyk": null,
      "pantone": null,
      "usage": null
    },
    {
      "name": "Color #FCCB06",
      "hex": "#FCCB06",
      "rgb": [
        252,
        203,
        6
      ],
      "cmyk": null,
      "pantone": null,
      "usage": null
    },
    {
      "name": "Color #920000",
      "hex": "#920000",
      "rgb": [
        146,
        0,
        0
      ],
      "cmyk": null,
      "pantone": null,
      "usage": null
    },
    {
      "name": "Color #F8C300",
      "hex": "#F8C300",
      "rgb": [
        248,
        195,
        0
      ],
      "cmyk": null,
      "pantone": null,
      "usage": null
    },
    {
      "name": "Color #F6E078",
      "hex": "#F6E078",
      "rgb": [
        246,
        224,
        120
      ],
      "cmyk": null,
      "pantone": null,
      "usage": null
    },
    {
      "name": "Color #E9001A",
      "hex": "#E9001A",
      "rgb": [
        233,
        0,
        26
      ],
      "cmyk": null,
      "pantone": null,
      "usage": null
    }
  ],
  "typography": null,
  "resources": {
    "website": null,
    "branding_manual": null,
    "social_media": null
  },
  "assets": {
    "main": {
      "type": "symbol",
      "color": "/logos/ro-stema/symbol/color.svg",
      "dark_mode": null,
      "white": null,
      "black": null,
      "monochrome": null,
      "png": null
    },
    "horizontal": null,
    "vertical": null,
    "symbol": {
      "type": "symbol",
      "color": "/logos/ro-stema/symbol/color.svg",
      "dark_mode": null,
      "white": null,
      "black": null,
      "monochrome": null,
      "png": null
    },
    "favicon": null
  }
}
