{
  "id": "ro-ministerul-agriculturii",
  "slug": "ministerul-agriculturii",
  "name": "Ministerul Agriculturii şi Dezvoltării Rurale",
  "shortname": "madr",
  "category": "minister",
  "meta": {
    "version": "1.0",
    "last_updated": "2026-02-15",
    "keywords": [
      "agricultură",
      "dezvoltare-rurală",
      "fermier",
      "subvenții",
      "politică-agricolă"
    ],
    "quality": "draft"
  },
  "location": {
    "country_code": "RO",
    "county": null,
    "city": "București"
  },
  "description": "Ministerul Agriculturii şi Dezvoltării Rurale este instituția guvernamentală responsabilă de elaborarea și implementarea politicilor agricole și de dezvoltare rurală în România. Coordonează programe de sprijin pentru fermieri, gestionarea subvențiilor și reglementările privind producția agricolă și resursele rurale.",
  "usage_notes": null,
  "colors": [
    {
      "name": "Color #004990",
      "hex": "#004990",
      "rgb": [
        0,
        73,
        144
      ],
      "cmyk": null,
      "pantone": null,
      "usage": "primary"
    }
  ],
  "typography": null,
  "resources": {
    "website": null,
    "branding_manual": null,
    "social_media": null
  },
  "assets": {
    "main": {
      "type": "horizontal",
      "color": "/logos/ro-ministerul-agriculturii/horizontal/color.svg",
      "dark_mode": null,
      "white": "/logos/ro-ministerul-agriculturii/horizontal/white.svg",
      "black": "/logos/ro-ministerul-agriculturii/horizontal/black.svg",
      "monochrome": null,
      "png": null
    },
    "horizontal": {
      "type": "horizontal",
      "color": "/logos/ro-ministerul-agriculturii/horizontal/color.svg",
      "dark_mode": null,
      "white": "/logos/ro-ministerul-agriculturii/horizontal/white.svg",
      "black": "/logos/ro-ministerul-agriculturii/horizontal/black.svg",
      "monochrome": null,
      "png": null
    },
    "vertical": null,
    "symbol": null,
    "favicon": null
  }
}
