{
  "id": "md-steag",
  "slug": "steagul-republicii-moldova",
  "name": "Steagul Republicii Moldova",
  "shortname": "steag",
  "category": "altele",
  "meta": {
    "version": "1.0",
    "last_updated": "2026-10-10",
    "keywords": [
      "moldova",
      "steag",
      "drapel",
      "flag",
      "tricolor",
      "republica moldova"
    ],
    "quality": "verified",
    "seo_title": "Steagul Republicii Moldova | Identitate.md",
    "seo_description": "Descarcă sigla oficială a Steagului Republicii Moldova în format SVG. Culori HEX/RGB și identitatea vizuală oficială."
  },
  "location": {
    "country_code": "MD",
    "city": "Chișinău"
  },
  "description": "Drapelul de Stat al Republicii Moldova este un tricolor dreptunghiular cu trei benzi verticale egale, în ordinea albastru, galben și roșu de la hampă. În centrul benzii galbene este Stema de Stat; proporția drapelului este 1:2.",
  "assets": {
    "main": {
      "type": "horizontal",
      "color": "/logos/md-steag/horizontal-color.svg"
    },
    "horizontal": {
      "type": "horizontal",
      "color": "/logos/md-steag/horizontal-color.svg"
    }
  }
}
