{
  "id": "ro-ministerul-economiei",
  "slug": "ministerul-economiei",
  "name": "Ministerul Economiei",
  "shortname": "me",
  "category": "minister",
  "meta": {
    "version": "1.0",
    "last_updated": "2026-02-15",
    "keywords": [
      "minister",
      "economie",
      "politici economice",
      "industrie",
      "antreprenoriat"
    ],
    "quality": "draft"
  },
  "location": {
    "country_code": "RO",
    "county": null,
    "city": "București"
  },
  "description": "Ministerul Economiei este instituția guvernamentală responsabilă pentru elaborarea și implementarea politicilor economice, industriale și pentru dezvoltarea mediului de afaceri în România. Coordonează inițiative pentru competitivitate, atragerea investițiilor și reglementări sectoriale.",
  "usage_notes": null,
  "colors": [
    {
      "name": "Color #004990",
      "hex": "#004990",
      "rgb": [
        0,
        73,
        144
      ],
      "cmyk": null,
      "pantone": null,
      "usage": "primary"
    }
  ],
  "typography": null,
  "resources": {
    "website": null,
    "branding_manual": null,
    "social_media": null
  },
  "assets": {
    "main": {
      "type": "horizontal",
      "color": "/logos/ro-ministerul-economiei/horizontal/color.svg",
      "dark_mode": null,
      "white": "/logos/ro-ministerul-economiei/horizontal/white.svg",
      "black": "/logos/ro-ministerul-economiei/horizontal/black.svg",
      "monochrome": null,
      "png": null
    },
    "horizontal": {
      "type": "horizontal",
      "color": "/logos/ro-ministerul-economiei/horizontal/color.svg",
      "dark_mode": null,
      "white": "/logos/ro-ministerul-economiei/horizontal/white.svg",
      "black": "/logos/ro-ministerul-economiei/horizontal/black.svg",
      "monochrome": null,
      "png": null
    },
    "vertical": null,
    "symbol": null,
    "favicon": null
  }
}
