{
  "id": "ro-ministerul-muncii",
  "slug": "ministerul-muncii",
  "name": "Ministerul Muncii",
  "shortname": "mm",
  "category": "minister",
  "meta": {
    "version": "1.0",
    "last_updated": "2026-02-15",
    "keywords": [
      "ministerul muncii",
      "muncă",
      "protecție socială",
      "piața muncii",
      "locuri de muncă",
      "asigurări sociale"
    ],
    "quality": "draft"
  },
  "location": {
    "country_code": "RO",
    "county": null,
    "city": "București"
  },
  "description": "Ministerul Muncii elaborează și implementează politici publice privind piața muncii, ocuparea forței de muncă și protecția socială. Coordonează programe și reglementări pentru drepturile angajaților și sistemele de asigurări sociale.",
  "usage_notes": null,
  "colors": [
    {
      "name": "Color #004990",
      "hex": "#004990",
      "rgb": [
        0,
        73,
        144
      ],
      "cmyk": null,
      "pantone": null,
      "usage": "primary"
    }
  ],
  "typography": null,
  "resources": {
    "website": null,
    "branding_manual": null,
    "social_media": null
  },
  "assets": {
    "main": {
      "type": "horizontal",
      "color": "/logos/ro-ministerul-muncii/horizontal/color.svg",
      "dark_mode": null,
      "white": null,
      "black": null,
      "monochrome": null,
      "png": null
    },
    "horizontal": {
      "type": "horizontal",
      "color": "/logos/ro-ministerul-muncii/horizontal/color.svg",
      "dark_mode": null,
      "white": null,
      "black": null,
      "monochrome": null,
      "png": null
    },
    "vertical": null,
    "symbol": null,
    "favicon": null
  }
}
