{
  "id": "ro-ministerul-transporturilor",
  "slug": "ministerul-transporturilor",
  "name": "Ministerul Transporturilor",
  "shortname": "mt",
  "category": "minister",
  "meta": {
    "version": "1.0",
    "last_updated": "2026-02-15",
    "keywords": [
      "transporturi",
      "minister",
      "infrastructură",
      "autostrăzi",
      "căi ferate",
      "porturi"
    ],
    "quality": "draft"
  },
  "location": {
    "country_code": "RO",
    "county": "B",
    "city": "București"
  },
  "description": "Ministerul Transporturilor este responsabil cu elaborarea și implementarea politicilor publice în domeniul transporturilor rutiere, feroviare, maritime și aeriene. Coordonează proiecte de infrastructură și reglementează activitățile din sectorul transporturilor la nivel național.",
  "usage_notes": null,
  "colors": [
    {
      "name": "Color #004990",
      "hex": "#004990",
      "rgb": [
        0,
        73,
        144
      ],
      "cmyk": null,
      "pantone": null,
      "usage": "primary"
    }
  ],
  "typography": null,
  "resources": {
    "website": null,
    "branding_manual": null,
    "social_media": null
  },
  "assets": {
    "main": {
      "type": "horizontal",
      "color": "/logos/ro-ministerul-transporturilor/horizontal/color.svg",
      "dark_mode": null,
      "white": "/logos/ro-ministerul-transporturilor/horizontal/white.svg",
      "black": "/logos/ro-ministerul-transporturilor/horizontal/black.svg",
      "monochrome": null,
      "png": null
    },
    "horizontal": {
      "type": "horizontal",
      "color": "/logos/ro-ministerul-transporturilor/horizontal/color.svg",
      "dark_mode": null,
      "white": "/logos/ro-ministerul-transporturilor/horizontal/white.svg",
      "black": "/logos/ro-ministerul-transporturilor/horizontal/black.svg",
      "monochrome": null,
      "png": null
    },
    "vertical": null,
    "symbol": null,
    "favicon": null
  }
}
