{
  "id": "md-stema",
  "slug": "stema-republicii-moldova",
  "name": "Stema Republicii Moldova",
  "shortname": "stema",
  "category": "altele",
  "meta": {
    "version": "1.0",
    "last_updated": "2026-10-10",
    "keywords": [
      "moldova",
      "stema",
      "stemă",
      "coat of arms",
      "heraldry",
      "statul",
      "republica moldova"
    ],
    "quality": "verified",
    "seo_title": "Stema Republicii Moldova | Identitate.md",
    "seo_description": "Descarcă sigla oficială a Stemei Republicii Moldova în format SVG. Culori HEX/RGB și identitatea vizuală oficială."
  },
  "location": {
    "country_code": "MD",
    "city": "Chișinău"
  },
  "description": "Stema de Stat a Republicii Moldova înfățișează un vultur care poartă pe piept un scut cu capul de bour și o stea între coarne; în cioc ține o cruce, iar în gheare o ramură de măslin și un sceptru.",
  "assets": {
    "main": {
      "type": "symbol",
      "color": "/logos/md-stema/stema-color.svg"
    },
    "symbol": {
      "type": "symbol",
      "color": "/logos/md-stema/stema-color.svg",
      "alternatives": [
        {
          "label": "Variantă alternativă",
          "path": "/logos/md-stema/stema-alt-color.svg",
          "preview": "checkerboard"
        }
      ]
    }
  }
}
