{
  "id": "ro-pnrr",
  "slug": "pnrr",
  "name": "Planul Național de Redresare și Reziliență",
  "shortname": "pnrr",
  "category": "proiect-ue",
  "meta": {
    "version": "1.0",
    "last_updated": "2026-02-15",
    "keywords": [
      "pnrr",
      "plan național",
      "redresare",
      "reziliență",
      "fonduri europene",
      "investiții"
    ],
    "quality": "draft"
  },
  "location": {
    "country_code": "RO",
    "county": null,
    "city": null
  },
  "description": "Planul Național de Redresare și Reziliență (PNRR) este strategia națională pentru gestionarea fondurilor europene destinate redresării și consolidării rezilienței economice după crize. Coordonează reformele și investițiile finanțate prin Mecanismul de Redresare și Reziliență.",
  "usage_notes": null,
  "colors": [
    {
      "name": "Color #FBCA07",
      "hex": "#FBCA07",
      "rgb": [
        251,
        202,
        7
      ],
      "cmyk": null,
      "pantone": null,
      "usage": "primary"
    },
    {
      "name": "Color #002B7F",
      "hex": "#002B7F",
      "rgb": [
        0,
        43,
        127
      ],
      "cmyk": null,
      "pantone": null,
      "usage": "secondary"
    },
    {
      "name": "Color #CE1126",
      "hex": "#CE1126",
      "rgb": [
        206,
        17,
        38
      ],
      "cmyk": null,
      "pantone": null,
      "usage": null
    },
    {
      "name": "Color #FFCE00",
      "hex": "#FFCE00",
      "rgb": [
        255,
        206,
        0
      ],
      "cmyk": null,
      "pantone": null,
      "usage": null
    },
    {
      "name": "Color #003399",
      "hex": "#003399",
      "rgb": [
        0,
        51,
        153
      ],
      "cmyk": null,
      "pantone": null,
      "usage": null
    },
    {
      "name": "Color #004990",
      "hex": "#004990",
      "rgb": [
        0,
        73,
        144
      ],
      "cmyk": null,
      "pantone": null,
      "usage": null
    }
  ],
  "typography": null,
  "resources": {
    "website": null,
    "branding_manual": null,
    "social_media": null
  },
  "assets": {
    "main": {
      "type": "horizontal",
      "color": "/logos/ro-pnrr/horizontal/color.svg",
      "dark_mode": null,
      "white": "/logos/ro-pnrr/horizontal/white.svg",
      "black": null,
      "monochrome": null,
      "png": null
    },
    "horizontal": {
      "type": "horizontal",
      "color": "/logos/ro-pnrr/horizontal/color.svg",
      "dark_mode": null,
      "white": "/logos/ro-pnrr/horizontal/white.svg",
      "black": null,
      "monochrome": null,
      "png": null
    },
    "vertical": null,
    "symbol": null,
    "favicon": null
  }
}
