{
  "id": "ro-sri",
  "slug": "sri",
  "name": "Serviciul Român de Informații",
  "shortname": "sri",
  "category": "agentie",
  "meta": {
    "version": "1.0",
    "last_updated": "2026-02-15",
    "keywords": [
      "securitate",
      "informații",
      "inteligență",
      "contrainformații",
      "serviciu"
    ],
    "quality": "draft"
  },
  "location": {
    "country_code": "RO",
    "county": "B",
    "city": "București"
  },
  "description": "Serviciul Român de Informații este instituția națională responsabilă cu prevenirea și contracararea amenințărilor la adresa securității naționale. Activează în culegerea, analiza și protecția informațiilor de interes pentru stat.",
  "usage_notes": null,
  "colors": [
    {
      "name": "Color #091739",
      "hex": "#091739",
      "rgb": [
        9,
        23,
        57
      ],
      "cmyk": null,
      "pantone": null,
      "usage": "primary"
    }
  ],
  "typography": null,
  "resources": {
    "website": null,
    "branding_manual": null,
    "social_media": null
  },
  "assets": {
    "main": {
      "type": "symbol",
      "color": "/logos/ro-sri/symbol/color.svg",
      "dark_mode": null,
      "white": "/logos/ro-sri/symbol/white.svg",
      "black": "/logos/ro-sri/symbol/black.svg",
      "monochrome": null,
      "png": null
    },
    "horizontal": null,
    "vertical": {
      "type": "vertical",
      "color": "/logos/ro-sri/vertical/color.svg",
      "dark_mode": null,
      "white": "/logos/ro-sri/vertical/white.svg",
      "black": "/logos/ro-sri/vertical/black.svg",
      "monochrome": null,
      "png": null
    },
    "symbol": {
      "type": "symbol",
      "color": "/logos/ro-sri/symbol/color.svg",
      "dark_mode": null,
      "white": "/logos/ro-sri/symbol/white.svg",
      "black": "/logos/ro-sri/symbol/black.svg",
      "monochrome": null,
      "png": null
    },
    "favicon": null
  }
}
