{
  "id": "ro-sie",
  "slug": "sie",
  "name": "Serviciul de Informații Externe",
  "shortname": "sie",
  "category": "agentie",
  "meta": {
    "version": "1.0",
    "last_updated": "2026-02-15",
    "keywords": [
      "serviciu",
      "informații",
      "externe",
      "securitate",
      "intelligence"
    ],
    "quality": "draft"
  },
  "location": {
    "country_code": "RO",
    "county": "B",
    "city": "București"
  },
  "description": "Serviciul de Informații Externe (SIE) este instituția responsabilă cu culegerea, analiza și furnizarea de informații de securitate din mediul extern pentru protejarea intereselor naționale. Oferă sprijin informativ decidenților și dezvoltă cooperări internaționale în domeniul informațiilor.",
  "usage_notes": null,
  "colors": [
    {
      "name": "black",
      "hex": "#000000",
      "rgb": [
        0,
        0,
        0
      ],
      "cmyk": null,
      "pantone": null,
      "usage": "primary"
    },
    {
      "name": "white",
      "hex": "#FFFFFF",
      "rgb": [
        255,
        255,
        255
      ],
      "cmyk": null,
      "pantone": null,
      "usage": "neutral"
    }
  ],
  "typography": null,
  "resources": {
    "website": null,
    "branding_manual": null,
    "social_media": null
  },
  "assets": {
    "main": {
      "type": "symbol",
      "color": "/logos/ro-sie/symbol/color.svg",
      "dark_mode": null,
      "white": "/logos/ro-sie/symbol/white.svg",
      "black": "/logos/ro-sie/symbol/black.svg",
      "monochrome": null,
      "png": null
    },
    "horizontal": null,
    "vertical": null,
    "symbol": {
      "type": "symbol",
      "color": "/logos/ro-sie/symbol/color.svg",
      "dark_mode": null,
      "white": "/logos/ro-sie/symbol/white.svg",
      "black": "/logos/ro-sie/symbol/black.svg",
      "monochrome": null,
      "png": null
    },
    "favicon": null
  }
}
