{
  "id": "ro-ministerul-culturii",
  "slug": "ministerul-culturii",
  "name": "Ministerul Culturii",
  "shortname": "mc",
  "category": "minister",
  "meta": {
    "version": "1.0",
    "last_updated": "2026-02-15",
    "keywords": [
      "minister",
      "cultură",
      "patrimoniu",
      "arte",
      "guvern"
    ],
    "quality": "draft"
  },
  "location": {
    "country_code": "RO",
    "county": null,
    "city": "București"
  },
  "description": "Ministerul Culturii este instituția guvernamentală responsabilă de politici publice în domeniul culturii, patrimoniului și industriilor culturale din România. Promovează, protejează și valorifică patrimoniul cultural și susține dezvoltarea creației artistice.",
  "usage_notes": null,
  "colors": [
    {
      "name": "Color #004990",
      "hex": "#004990",
      "rgb": [
        0,
        73,
        144
      ],
      "cmyk": null,
      "pantone": null,
      "usage": "primary"
    }
  ],
  "typography": null,
  "resources": {
    "website": null,
    "branding_manual": null,
    "social_media": null
  },
  "assets": {
    "main": {
      "type": "horizontal",
      "color": "/logos/ro-ministerul-culturii/horizontal/color.svg",
      "dark_mode": null,
      "white": "/logos/ro-ministerul-culturii/horizontal/white.svg",
      "black": "/logos/ro-ministerul-culturii/horizontal/black.svg",
      "monochrome": null,
      "png": null
    },
    "horizontal": {
      "type": "horizontal",
      "color": "/logos/ro-ministerul-culturii/horizontal/color.svg",
      "dark_mode": null,
      "white": "/logos/ro-ministerul-culturii/horizontal/white.svg",
      "black": "/logos/ro-ministerul-culturii/horizontal/black.svg",
      "monochrome": null,
      "png": null
    },
    "vertical": null,
    "symbol": null,
    "favicon": null
  }
}
